{
  "schemaVersion": "1.0",
  "sessionRef": "session:1111111111111111111111111111111111111111111111111111111111111111",
  "projectFingerprint": "2222222222222222222222222222222222222222222222222222222222222222",
  "reportId": "report-registration",
  "runPath": ".artifacts/utsuri/レビュー run",
  "reportSha256": "3333333333333333333333333333333333333333333333333333333333333333",
  "createdAt": "2026-08-11T00:00:00.000Z"
}
